Version,2.2.0,,,,,,,,
tra002127,fra,setID,ID de l'ensemble,Le nom d'un ensemble de valeurs.,"Un ensemble est un groupe d'unités, d'attributs, de catégories, de spécimens ou de compartiments qui peuvent être utilisés pour une mesure, une méthode ou un attribut.",2.0.0,2.0.0,added in V2.0.0,
tra002128,fra,qualityIndicators,Type de partie de qualité,Le type de partie pour les parties de qualité.,Utilisé uniquement pour les entrées du dictionnaire relatives aux parties.,2.0.0,2.0.0,added in V2.0.0,
tra002129,fra,qualityIndSets,Ensembles de qualité,"Ensembles de mesures de qualité. Par exemple, PCR (réaction en chaîne par polymérase) a un ensemble de mesures de qualité.","Les ensembles sont des listes de valeurs d'entrée. Chaque valeur d'entrée dans un ensemble est une partie (a un partID) qui peut être réutilisée entre les ensembles. Par exemple, un ensemble A peut contenir les valeurs ""oui"" et ""non"", et un ensemble B peut contenir les valeurs ""oui"", ""non"" et ""peut-être"". Les types de partie avec des ensembles comprennent les agrégations, les compartiments, les manques, les indicateurs de qualité, les spécimens et les unités. Les mesures avec catégories et types de données ont leurs propres ensembles de catégories spécifiques (catSetID) car leurs valeurs d'entrée sont uniques et ne sont pas réutilisées.",2.0.0,2.0.0,added in V2.0.0,
tra002130,fra,protocolRelationships,Table des relations de protocoles,La table qui contient de l'information et des détails sur une méthode donnée.,NA,2.0.0,2.0.0,added in V2.0.0,
tra002131,fra,translationsRequired,En-têtes obligatoires du tableau de traduction,En-têtes obligatoires dans le table des traductions.,NA,2.0.0,2.0.0,added in V2.0.0,
tra002132,fra,partsOrder,Ordre des colonnes du tableau des pièces,Ordre des en-têtes dans le tableau des pièces.,NA,2.0.0,2.0.0,added in V2.0.0,
tra002133,fra,translationsOrder,L’ordre des colonnes de la table de traduction,Indique l’ordre des colonnes dans une table de traduction.,NA,2.0.0,2.0.0,added in V2.0.0,
tra002134,fra,quantAggScale,Quantitatif,"L'échelle d'agrégation ""quantAggScale"".",NA,2.0.0,2.0.0,added in V2.0.0,
tra002135,fra,rainy,Pluvieux,"CatSetégorie qualitative pour la mesure météorologique, spécifiant un jour de pluie.",NA,2.0.0,2.0.0,"added in V2.0.0, github issue #124 and #204",
tra002136,fra,ranSeq,Méthode de sélection aléatoire pour le séquençage,Indique la méthode de sélection aléatoire pour le séquençage,Aucun ensemble d'amorces ne doit être utilisé si cette option est sélectionnée.,2.0.0,2.0.0,added in V2.0.0,
tra002137,fra,raws,Echantillon d'eaux usées brutes,Echantillon d'eaux usées brutes,NA,1.0.0,2.0.0,NA,
tra002138,fra,swgTrck,Camion à eaux usées,Camion de vidange.,NA,1.0.0,2.0.0,"description wording, structure",
tra002139,fra,rawWWdown,Eaux usées brutes en aval d'un site,En aval d'un site. Voir partType = rawWWup.,NA,2.0.0,2.0.0,added in V2.0.0,
tra002140,fra,rawWWup,Eaux usées brutes en amont d'un site,"En amont d'un site. Utilisé lorsqu'il n'y a pas d'accès direct à l'inconjuctiion des eaux usées d'un site avec un échantillon en aval. Par exemple, si le site est une maison de soins de longue durée, mais qu'il n'y a pas d'accès à la sortie de nettoyage du bâtiment ou de la propriété. Utiliser deux échantillons, un en amont et un en aval.",NA,2.0.0,2.0.0,added in V2.0.0,
tra002141,fra,collPer,Période de collecte,"Période de collecte. Période au cours de laquelle l'échantillon a été collecté, en heures. Vous pouvez également utiliser collectionStart et collectionEnd.","Exemples : 1 heure, 6 heures, 24 heures",2.0.0,2.0.0,added in V2.0.0,
tra002142,fra,partsRequired,En-têtes obligatoires du tableau des parties,En-têtes obligatoires dans le tableau des pièces.,NA,2.0.0,2.0.0,added in V2.0.0,
tra002143,fra,regular,Régulier,Une mesure ou un échantillon prélevé à des fins de surveillance ou d'épidémiologie.,"Une mesure ""régulière"" est la valeur par défaut. Les données manquantes seront recodées dans ce but.",2.0.0,2.0.0,added in V2.0.0,
tra002144,fra,regularReportTableSet,Tables des rapports réguliers,Tables utilisées pour la communication quotidienne de nouvelles mesures et d'informations sur la collecte d'échantillons.,NA,2.0.0,2.0.0,added in V2.0.0,
tra002145,fra,relHumidUnitSet,Ensemble d'unités d'humidité relative,Ensemble d'unités pour les mesures d'humidité relative.,NA,2.0.0,2.0.0,added in V2.0.0,
tra002146,fra,replicateSet,Ensemble de catégories de type de réplicat,L'ensemble de catégories pour les valeurs du type de réplicat.,NA,2.0.0,2.0.0,added in V2.0.0,
tra002147,fra,siteID,ID du site,Identifiant unique pour l'échantillon. Suggestion:siteID-date-index.,NA,1.0.0,2.0.0,"description wording, structure",
tra002148,fra,qualityFlag,Indicateur de qualité,Un champ pour signaler un problème de qualité - ou son absence - pour un échantillon ou une mesure.,Les types d'indicateurs de qualité varient selon le contexte ; veuillez consulter le QulaityFlagSet pour en avoir la confirmation.,2.0.0,2.0.0,added in V2.0.0,
tra002149,fra,charLength,longueur de caractère,Le nombre de caractères utilisés pour les noms larges.,NA,2.2.0,2.2.0,added in V2.2.0,
tra002150,fra,protocols,Table de protocoles,La table qui contient les protocoles.,NA,2.0.0,2.0.0,added in V2.0.0,
tra002151,fra,siteType,Type de site,Type de site ou d'institution du site d'échantillonnage.,NA,1.0.0,2.0.0,"description wording, structure",
tra002152,fra,protocolSteps,Table des étapes de protocole,La table qui contient les échantillons environnementaux.,Les méthodes sont toute procédure ou approche permettant d'effectuer un échantillon ou une mesure.,1.0.0,2.0.0,"updated from assay method into 2 tables, restructured.",
tra002153,fra,collNum,Numéro de collection,"Le nombre de sous-échantillons qui ont été combinés pour créer l'échantillon. Utiliser NA pour un échantillonnage continu, proportionnel ou passif.",NA,2.0.0,2.0.0,added in V2.0.0,
tra002154,fra,results,Classe de tables de résultats,Spécifie une classe pour les tables de rapport pour indiquer qu'ils sont des tables de résultats.,"Utilisé uniquement pour mieux spécifier l'objectif des tables de rapports, distincts des autres classes de cette manière.",2.0.0,2.0.0,added in V2.0.0,
tra002155,fra,uCampus,Campus universitaire,Campus universitaire.,NA,1.1.0,2.0.0,added in version 1.1,
tra002156,fra,wwtpInd,Station d'épuration des eaux usées industrielles,Station de traitement des eaux usées industrielle.,NA,1.0.0,2.0.0,"description wording, structure",
tra002157,fra,role,Rôle du contact,Précise le rôle organisationnel d'un contact donné.,NA,2.0.0,2.0.0,added in V2.0.0,
tra002158,fra,rP100,"Taux pour 100,000",Unités pour décrire une mesure de population d'un taux d'incidence de cas pour 100 000 personnes d'une maladie donnée.,Unité pour une mesure de population ou de maladie afin d'expliquer les effets cliniques au niveau de la population.,2.0.0,2.0.0,added in V2.0.0,
tra002159,fra,rppw,Eaux usées brutes après pasteurisation.,Eaux usées brutes après pasteurisation.,NA,1.0.0,2.0.0,NA,
tra002160,fra,sa,Échantillon,Mesure faite dans un échantillon d'eau usée.,NA,2.0.0,2.0.0,added in V2.0.0,
tra002161,fra,repOrg1,Département ou région de santé publique,Le département ou la région de santé publique où se trouve le site ou l'institut. Voir également `healthRegion` s'il existe une autorité régionale de prestation de soins de santé distincte.,NA,1.1.0,2.0.0,"description wording, structure",
tra002162,fra,repOrg2,Région de planification de la santé,L'autorité de planification de la santé où se trouve le site ou l'institut. Voir aussi `publicHealthDepartment`.,NA,1.1.0,2.0.0,"description wording, structure",
tra002163,fra,relationshipID,Relation entre échantillions,Attribut permettant de spécifier la relation entre des échantillons associés.,Avec `sampleIDSub` et `relationshipID` une rangée donnée du `sampleRelationships` devrait dire : [sampleIDSubject] est un [relationshipID] de [sampleIDObject].,2.0.0,2.0.0,added in V2.0.0,
tra002164,fra,geoLat,Latitude géographique,Position géographique du site d'échantillonnage. Latitude exprimée en coordonnées décimales (ex. 45.424721),NA,1.0.0,2.0.0,NA,
tra002165,fra,sampleMatSet,Ensemble de catégories de matériaux d'échantillon,Ensemble de catégories pour les types de matières qui peuvent être trouvées dans un échantillon.,NA,2.0.0,2.0.0,added in V2.0.0,
tra002166,fra,setsOrder,Ordre des colonnes du tableau d'ensembles,Spécifie l'ordre des colonnes dans le table d'ensembles.,NA,2.0.0,2.0.0,added in V2.0.0,
tra002167,fra,setsRequired,Définit les en-têtes requis pour le table d'ensembles,En-têtes obligatoires dans le tableau des ensembles.,NA,2.0.0,2.0.0,added in V2.0.0,
tra002168,fra,sites,Table de site,La table qui contient de l'information sur un site ; l'endroit où un échantillon environnemental a été prélevé.,Le site d'un échantillon eviromental. Les informations contenues dans la table site ne changent pas régulièrement. Envisagez d'utiliser la table MeasureReport si les informations changent souvent. ,1.0.0,2.0.0,"description wording, structure",
tra002169,fra,stepIDObj,Index de l'étape de la méthode,"Spécifie l'index d'une étape de méthode dans un ensemble de méthodes, c'est-à-dire l'ordre des étapes dans un ensemble.","Remplissez ce champ en utilisant l'ID d'étape du protocole (partID = stepID). Avec `protocolIDSub` ou `stepIDSub` et `relationshipID`, la relation de protocole est définie comme suit : [protocolIDSubject ou stepIDSubject] [relationshipID] [protocolIDObject ou stepIDObject]. Ex : stepIDSubject précède protocolIDObject.",2.0.0,2.0.0,added in V2.0.0,
tra002170,fra,sampleRelSet,Ensemble de relations d'échantillons,Ensemble de catégories pour les valeurs valides de relationshipID dans la table sampleRelationships.,À n'utiliser que pour la relation ID de la table sampleRelationships.,2.0.0,2.0.0,added in V2.0.0,
tra002171,fra,qualityReportsRequired,Exigences de la table des rapports de qualité,Spécifie les colonnes requises dans table des rapports de qualité.,NA,2.0.0,2.0.0,added in V2.0.0,
tra002172,fra,geoLong,Longitude géographique,Position géographique du site d'échantillonnage. Longitude exprimée en coordonnées décimales (ex. -75.695000),NA,1.0.0,2.0.0,NA,
tra002173,fra,qualityReportsOrder,Ordre des colonnes la table des rapports de qualité,Spécifie l'ordre des colonnes dans la table des rapports de qualité.,NA,2.0.0,2.0.0,added in V2.0.0,
tra002174,fra,measures,Table de rapport de mesure,La table qui contient de l'information et des détails sur une mesure donnée.,NA,1.0.0,2.0.0,combined all measures tables into a single table,
tra002175,fra,sewerNetworkFileBLOB,Lien vers le fichier du réseau d'égouts,Un fichier contenant toute information additionnelle au sujet du réseau d'égouts associé é ce site d'échantillonnage (tous les formats sont acceptés).,NA,1.0.0,2.0.0,depreciated,
tra002176,fra,sarsCov2,SRAS-CoV-2,Indique un groupe de mesures/méthodes liées au virus SRAS-CoV-2.,"Les mesures du SRAS-CoV-2 ont les classes suivantes : protéines, allèles, variants, mutations, maladies.",2.0.0,2.0.0,added in V2.0.0,
tra002177,fra,saSpecimenSet,Ensemble de spécimens d'échantillon,Un ensemble de spécimens qui comprend uniquement un spécimen d'échantillon.,NA,2.0.0,2.0.0,added in V2.0.0,
tra002178,fra,wwtpMuC,Station d'épuration municipales pour les eaux usées combinées,Station de traitement des eaux usées municipales pour égouts combinés.,NA,1.0.0,2.0.0,"description wording, structure",
tra002179,fra,airTemp,Température ambiante,Température ambiante.,NA,1.0.0,2.0.0,"description wording, structure",
tra002180,fra,scriptSet,Ensemble de catégories de script de séquençage,L'ensemble des catégories pour les versions de script ,NA,2.0.0,2.0.0,added in V2.0.0,
tra002181,fra,bod5c,Demande biochimique d'oxygène carbonée sur 5 jours,"La quantité d'oxygène utilisée pour la dégradation biochimique de la matière organique selon des procédures de laboratoire standard en cinq (5) jours en présence d'un inhibiteur de nitrification, exprimée en milligrammes par litre (mg/l).",NA,1.1.0,2.0.0,"description wording, structure",
tra002182,fra,bod5t,Demande biochimique d'oxygène totale de 5 jours,Demande biochimique d'oxygène totale sur 5 jours.,NA,1.1.0,2.0.0,"description wording, structure",
tra002183,fra,envSnwF,Chute de neige,Neige (toute précipitations sous forme solide).,NA,1.0.0,2.0.0,"description wording, structure",
tra002184,fra,floRate,Débit,Débit d'eau usée.,NA,1.0.0,2.0.0,"description wording, structure",
tra002185,fra,seeUnitAggScale,Voir unité (échelle d'agrégation),Une valeur pour l'échelle d'agrégation à utiliser lorsque l'échelle d'agrégation dépend de celle spécifiée dans l'entrée de la liste des parties pour l'unité. ,"Lorsque vous rencontrez cette valeur, voyez l'unité utilisée pour cette entrée et suivez cette entrée d'échelle d'agrégation.",2.0.0,2.0.0,added in V2.0.0,
tra002186,fra,seeUnitData,Voir unité (type de données),Le type de données de l'entrée lorsque le type de données pour une entrée donnée est spécifié par l'unité utilisée.,"Utilisé uniquement pour les mesures, pour lesquelles l'entrée du type de données est utilisée pour valider la valeur entrée dans le champ de valeur. Dans ces cas, cependant, le type de données dépend davantage de l'unité que de la mesure, et cette entrée invite donc les utilisateurs à consulter le type de données de l'unité.",2.0.0,2.0.0,added in V2.0.0,
tra002187,fra,seeUnitVal,See unit (value),"Une valeur pour la valeur maximale ou minimale dans le dictionnaire, à utiliser lorsque la valeur maximale ou minimale est déterminée par l'unité. ",Utilisé pour les mesures lorsque les contraintes sur les valeurs maximales et minimales sont spécifiées par l'unité et non par la mesure.,2.0.0,2.0.0,added in V2.0.0,
tra002188,fra,loq,Température des eaux usées,Température de l'eau usée.,NA,1.1.0,2.0.0,added in V2.0.0,
tra002189,fra,snfl,Lien vers le fichier du réseau d'égouts,Lien vers un fichier contenant toute information additionnelle au sujet du réseau d'égouts associé é ce site d'échantillonnage (tous les formats sont acceptés).,NA,1.0.0,2.0.0,depreciated,
tra002190,fra,storTempDef,température de stockage de l'échantillion,"Tempéraure de stockage par défaut quand un nouvel échantillon est créé pour ce site. Se référer é la colonne ""storageTempC"" dans la table ""Sample""",NA,1.0.0,2.0.0,depreciated,
tra002191,fra,tyOtDep2,Autre type,Description du site d'échantillonnage dans le cas oé un type adéquat n'est pas disponible.,NA,1.0.0,2.0.0,depreciated,
tra002192,fra,phos,Phosphore total,Phosphore total,NA,1.1.0,2.0.0,"description wording, structure",
tra002193,fra,seqLaySet,Ensemble de catégories pour la disposition du séquençage,Ensemble de catégories pour la disposition du matériel génétique utilisé dans le séquençage.,NA,2.0.0,2.0.0,added in V2.0.0,
tra002194,fra,seqSelSet,Ensemble de catégories pour la méthode de sélection du séquençage,Ensemble de catégories pour la méthode de sélection utilisée dans le séquençage,NA,2.0.0,2.0.0,added in V2.0.0,
tra002195,fra,seqStratSet,Ensemble de catégories de stratégie de séquençage,Ensemble de catégories pour la stratégie de séquençage utilisée pour une analyse.,NA,2.0.0,2.0.0,added in V2.0.0,
tra002196,fra,serialDilution,Dilution en série,La méthode de dilution en série pour évaluer l'inhibition.,NA,2.0.0,2.0.0,added in V2.0.0,
tra002197,fra,phostot,Phosphates totaux,Phosphates totaux.,NA,1.1.0,2.0.0,"description wording, structure",
tra002198,fra,status,Statut,"Indique si la partie est toujours active et peut être utilisée dans la version la plus récente de l'ODM. Les valeurs sont ""actif"" ou ""inactif"".",NA,1.0.0,2.0.0,added in V2.0.0,
tra002199,fra,sampleRelationshipsRequired,Exigences de la table des relations d'échantillons,Indique les colonnes requises dans une table des relations d'échantillons.,NA,2.0.0,2.0.0,added in V2.0.0,
tra002200,fra,sampleRelationshipsOrder,L’ordre des colonnes de la table des relations d'échantillons,Indique l’ordre des colonnes dans une table des relations d'échantillons.,NA,2.0.0,2.0.0,added in V2.0.0,
tra002201,fra,measureSets,Table de rapport des ensembles de mesures,La table qui identifie les ensembles de mesures.,NA,2.0.0,2.0.0,added in V2.0.0,
tra002202,fra,firstReleased,Première diffusion,La version de l'ODM dans laquelle une partie a été publiée pour la première fois.,NA,2.0.0,2.0.0,added in V2.0.0,
tra002203,fra,lastUpdated,Date de la dernière mise à jour,La version dans laquelle la partie a été mise à jour pour la dernière fois.,Toute modification de la liste des parties entraînera une mise à jour du champ lastUpdated à la version du dictionnaire où la mise à jour a eu lieu. ,2.0.0,2.0.0,added in V2.0.0,
tra002204,fra,aDateStart,Date-heure,Date à laquelle la mesure a été réalisée.,NA,1.0.0,2.0.0,NA,
tra002205,fra,sevSet,Ensemble de catégories de sévérité,Un ensemble de catégories pour les indicateurs de gravité.,NA,2.0.0,2.0.0,added in V2.0.0,
tra002206,fra,siteMeasureID,ID de la mesure du site,Identifiant unique utilisé dans la table horizontale seulement. Utiliser quand toutes les mesures sont effectuées sur le méme échantillon.,NA,1.0.0,2.0.0,depreciated,
tra002207,fra,shedSet,Ensemble de catégories pour le bassin d'échantillonnage,L'ensemble de catégories contenant toutes les valeurs valides de sampleshed.,NA,2.0.0,2.0.0,added in V2.0.0,
tra002208,fra,ship,Navire,Un bateau de croisière ou un autre navire.,NA,2.0.0,2.0.0,added in V2.0.0,
tra002209,fra,protocolsRequired,Exigences de la table de protocoles,Indique les colonnes requises dans la table de protocoles.,NA,2.0.0,2.0.0,added in V2.0.0,
tra002210,fra,si,Site,Mesure d'eau usée passant à travers un site,NA,2.0.0,2.0.0,added in V2.0.0,
tra002211,fra,tssConc,Concentration des matières en suspension,Matiéres en suspension,NA,1.0.0,2.0.0,"description wording, structure",
tra002212,fra,sinLay,Disposition simple,Indique la disposition simple pour une méthode de séquençage.,NA,2.0.0,2.0.0,added in V2.0.0,
tra002213,fra,siSaSpecimenSet,Ensemble de spécimens de site ou d'échantillon,Un ensemble de spécimens qui comprend un spécimen de site ou d'échantillon.,NA,2.0.0,2.0.0,added in V2.0.0,
tra002214,fra,siSpecimenSet,Ensemble de spécimens de sites,Un ensemble de spécimens qui ne comprend qu'un spécimen de site.,NA,2.0.0,2.0.0,added in V2.0.0,
tra002215,fra,uSiteMeasureID,ID de la mesure du site U,Identifiant unique pour le site d'échantillonnage.,NA,2.0.0,2.0.0,added in V2.0.0,
tra002216,fra,siteFeat,Groupe de caractéristiques du site,Un groupe de mesures/méthodes environnementales et celles qui se rapportent aux caractéristiques d'un site.,NA,2.0.0,2.0.0,added in V2.0.0,
tra002217,fra,aDate,Date d'analyse,Date à laquelle la mesure a été effectuée au laboratoire.,NA,1.0.0,2.1.0,Github Issue #211,
tra002218,fra,asID,ID de la procédure d'analyse,"Crée un lien avec la table ""AssayMethod"" pour décrire la méthode employée pour effectuer la mesure. Utiliser l'identifiant de l'instrument pour des mesures non virales.",NA,1.0.0,2.0.0,"depreciated, now covered by partID = methodID",
tra002219,fra,protocolsOrder,L’ordre des colonnes de la table de protocoles,Indique l’ordre des colonnes dans la table de protocoles.,NA,2.0.0,2.0.0,added in V2.0.0,
tra002220,fra,qualityReports,Table des rapports de qualité,Le table pour enregistrer les différents paramètres et indicateurs de qualité pour les échantillons et les mesures.,NA,2.0.0,2.0.0,added in V2.0.0,
tra002221,fra,countriesRequired,En-têtes obligatoires du tableau de pays,En-têtes obligatoires dans le table des pays.,NA,2.1.0,2.1.0,added in V2.1.0,
tra002222,fra,aDateEnd,Date de l'analyse,Date à laquelle la mesure a été réalisée en laboratoire.,NA,1.0.0,2.0.0,Depreciated. See issue #211. https://github.com/Big-Life-Lab/PHES-ODM/issues/211,
tra002223,fra,siteTypeSet,Ensemble de catégories de sites,Ensemble de catégories pour le type de site d'échantillonnage.,NA,2.0.0,2.0.0,added in V2.0.0,
tra002224,fra,fraction,Fraction analyzé,Fraction de l'échantillon qui est analysée.,NA,1.0.0,2.0.0,"description wording, structure",
tra002225,fra,snowy,Neigeux,"CatSetégorie qualitative pour la mesure météorologique, spécifiant un jour de neige.",NA,2.0.0,2.0.0,"added in V2.0.0, github issue #124 and #204",
tra002226,fra,turb,Tubidité,"Mesure de la turbidité de l'eau ou d'un échantillon liquide, quantifiant la clarté ou l'opacité relative d'un liquide. Très révélateur de la qualité de l'eau.",NA,1.0.0,2.0.0,github issue #122,
tra002227,fra,solidSeparationSet,Ensemble de catégories de séparation des solides,Ensemble de catégories pour la séparation des solides.,NA,2.0.0,2.0.0,added in V2.0.0,
tra002228,fra,sourceProtocol,Source du protocole,Utilisé pour indiquer le protocole qui a servi de référence ou de base pour le protocole actuel.,Remplir avec protocolID.,2.0.0,2.0.0,added in V2.0.0,
tra002229,fra,sourceStep,Source de l'étape du protocole,Spécifie l'étape de protocole qui sert de base à une étape de protocole.,Remplir avec un ID d'étape de protocole (stepID),2.0.0,2.0.0,added in V2.0.0,
tra002230,fra,sovereignty,Statut souverain d'un pays,"Statut de souveraineté d'un pays, indiquant quel État a la plus haute juridiction sur un territoire donné.","Préprogrammés dans les tables du dictionnaire, ils ne sont pas modifiables par les utilisateurs.",2.1.0,2.1.0,added in V2.1.0,
tra002231,fra,specHumidUnitSet,Ensemble d'unités d'humidité spécifique,Ensemble d'unités pour les mesures d'humidité spécifique.,NA,2.0.0,2.0.0,added in V2.0.0,
tra002232,fra,specifies,Spécifie,Indique que l'objet étape ou protocole spécifie les détails du sujet étape ou protocole dans le conteneur de protocole global.,À n'utiliser que pour la relation ID de la table protocolRelationships table relationshipID.,2.0.0,2.0.0,added in V2.0.0,
tra002233,fra,sentDate,Date d'envoi de l'échantillon,La date à laquelle l'échantillon a été envoyé pour être analysé dans un laboratoire.,NA,2.0.0,2.0.0,"added in V2.0.0, Update in line with Github Issue #211",
tra002234,fra,specimens,Type de partie du spécimen,La substance sur laquelle l'observation a été faite.,Voir partID = specimentID,2.0.0,2.0.0,added in V2.0.0,
tra002235,fra,countriesOrder,L’ordre des colonnes de la table de pays,Indique l’ordre des colonnes dans une table des pays.,NA,2.1.0,2.1.0,added in V2.1.0,
tra002236,fra,spike,Matrice d'ensemencement et récupération,Méthode d'évaluation de l'inhibition par matrice d'ensemencement et récupération.,NA,2.0.0,2.0.0,added in V2.0.0,
tra002237,fra,spikeMatSet,Ensemble de catégories pour matrice enrichie,L'ensemble de catégorie pour spikeMat (matrices dans lesquelles la cible de contrôle de l'efficacité de la récupération est injectée).,NA,2.0.0,2.0.0,added in V2.0.0,
tra002238,fra,spikeTargetSet,Ensemble de catégories pour l'efficacité de la récupération de la matiére enrichie,L'ensemble de catégories contenant toutes les catégories valides pour la cible de contrôle de l'efficacité de la récupération (ou de matrice enrichie).,NA,2.0.0,2.0.0,added in V2.0.0,
tra002239,fra,wind,Pluie,Pluie (toute précipitation sous forme liquide).,NA,2.0.0,2.0.0,added in V2.0.0,
tra002240,fra,sss,refuge,Autre type d'hébergement des services sociaux,NA,2.0.0,2.0.0,added in V2.0.0,
tra002241,fra,stabPnd,Étang de stabilisation,Spécifie un type de site qui est un bassin conçu et construit pour le traitement des eaux usées afin de réduire le contenu organique et d'éliminer les agents pathogènes des eaux usées.,NA,1.0.0,2.0.0,"description wording, structure",
tra002242,fra,stateProvLevel,"Départements, États ou provinces","Départements, États ou provinces",NA,2.0.0,2.1.0,added in V2.0.0,
tra002243,fra,stepID,ID de l'étape du protocole,L'identifiant unique pour une étape de méthode spécifique.,"Les étapes de la méthode sont les éléments constitutifs d'un ensemble de méthodes plus vaste, ces dernières étant liées à des rapports de mesure spécifiques.",2.0.0,2.0.0,added in V2.0.0,
tra002244,fra,sampleRelationships,Table des relations d'échantillons,Table qui permettant d'enregistrer les relations entre les échantillons.,"Conçu spécifiquement pour saisir des informations sur les relations parents-enfants entre les échantillons, et permettre de suivre la lignée des échantillons pour les échantillons individuels et groupés.",2.0.0,2.0.0,added in V2.0.0,
tra002245,fra,statusSet,Ensemble de catégories de statut,Un ensemble de catégories pour partID = status pour indiquer si une partie est en cours d'utilisation ou non.,NA,2.0.0,2.0.0,added in V2.0.0,
tra002246,fra,stdConcentrationUnitSet,Ensemble d'unités de concentration standard,Ensemble d'unités pour les mesures de concentration.,NA,2.0.0,2.0.0,added in V2.0.0,
tra002247,fra,recDate,Date de réception de l'échantillon,La date à laquelle l'échantillon a été reçu au laboratoire pour analyse.,NA,2.0.0,2.0.0,"added in V2.0.0, Update in line with Github Issue #211",
tra002248,fra,translationID,ID synthétique pour la table translations,Un identifiant unique et auto-incrémentiel généré pour produire un identifiant unique et une clé primaire pour chaque ligne de la table translations.,NA,2.2.0,2.2.0,added in V2.2.0,
