Version,2.2.0,,,,,,,,
tra000708,eng,setsRequired,Sets table required headers,Required headers in the Sets table.,NA,2.0.0,2.0.0,added in V2.0.0,
tra000709,eng,sites,Sites table,The table that contains information about a site; the location where an environmental sample was taken.,The site of an eviromental sample. Information in the site table does not regularly change. Consider using the MeasureReport table if the infomation changes often. ,1.0.0,2.0.0,"description wording, structure",
tra000710,eng,stepIDObj,Step ID Object,"The object of the relationship between one protocol step and another step or protocol, within a given protocol ID container.",Populate this field using Protocol Step ID (partID = stepID). Together with `protocolIDSub` or `stepIDSub` and `relationshipID` the row of `protocolRelationships` should say: [protocolIDSubject or stepIDSubject]  [relationshipID] [protocolIDObject or stepIDObject]. Ex: stepIDSubject  precedes protocolIDObject.,2.0.0,2.0.0,added in V2.0.0,
tra000711,eng,sampleRelSet,Sample relationships set,set for valid values of relationshipID in the sampleRelationships table.,Use only for sampleRelationships table relationshipID.,2.0.0,2.0.0,added in V2.0.0,
tra000712,eng,qualityReportsRequired,Quality report table required headers,Specifies the columns required in the Quality Reports table.,NA,2.0.0,2.0.0,added in V2.0.0,
tra000713,eng,geoLong,Longitude,"Geographical location, longitude in decimal coordinates, ie.: (-75.695000)",NA,1.0.0,2.0.0,NA,
tra000714,eng,qualityReportsOrder,Quality rerpots table column order,Specifies the order of the columns in the Quality Reports table.,NA,2.0.0,2.0.0,added in V2.0.0,
tra000715,eng,measures,Measure report table,The table that contains information and details about a given measure,adapt from verson 1 documentation,1.0.0,2.0.0,combined all measures tables into a single table,
tra000716,eng,sewerNetworkFileBLOB,Sewer network file link depreciated,Link to a file that has any detailed information about the sewer network associated with the site (any format).,NA,1.0.0,2.0.0,depreciated,
tra000717,eng,sarsCov2,SARS-CoV-2,A group of measures/methods related to the SARS-CoV-2 virus.,"SARS-CoV-2 measures have the following classes: proteins, alleles, variants, mutations, diseases.",2.0.0,2.0.0,added in V2.0.0,
tra000718,eng,saSpecimenSet,Sample specimen set,A specimen set that inculdes only a sample specimen.,NA,2.0.0,2.0.0,added in V2.0.0,
tra000719,eng,wwtpMuC,Municipal wastewater treatment plant for combined sewage,Municipal wastewater treatment plant for combined sewage,NA,1.0.0,2.0.0,"description wording, structure",
tra000720,eng,airTemp,Environmental temperature,Environmental temperature.,NA,1.0.0,2.0.0,"description wording, structure",
tra000721,eng,scriptSet,Sequencing script version set,The set for script versions ,NA,2.0.0,2.0.0,added in V2.0.0,
tra000722,eng,bod5c,5-Day carbonaceous biochemical oxygen demand,"The quantity of oxygen utilized for the biochemical degradation of organic matter under standard laboratory procedures in five (5) days in the presence of a nitrification inhibitor, expressed in milligrams per litre (mg/l).",NA,1.1.0,2.0.0,"description wording, structure",
tra000723,eng,bod5t,5-day total biochemical oxygen demand,5 day total biochemical oxygen demand.,NA,1.1.0,2.0.0,"description wording, structure",
tra000724,eng,envSnwF,Snowfall,"Snowfall, i.e. amount of precipitation in the form of snow.",NA,1.0.0,2.0.0,"description wording, structure",
tra000725,eng,floRate,Flow rate,Wastewater volumetric flow rate at the sample collection location over the 24-hr period during which the sample was collected.," If only an instantaneous flow measurement is available, it may be reported in units of million gallons per day. ",1.0.0,2.0.0,"description wording, structure",
tra000726,eng,seeUnitAggScale,See unit (aggregation scales),A value for aggregation scale to be used when the aggregation scale depends on that specified in the parts list entry for the unit. ,"When you encounter this value, see the unit being used for that entry and follow that aggregation scale entry.",2.0.0,2.0.0,added in V2.0.0,
tra000727,eng,seeUnitData,See unit (data type),The data type entry when the data type for a given entry is specified by the unit used.,"Only used for measures, which is where the data type entry is used to validate the entry in the value field. For these cases, however, the data type is more dependant on the unit than the measure , and so this entry directs users to consult the data type of the unit.",2.0.0,2.0.0,added in V2.0.0,
tra000728,eng,seeUnitVal,See unit (value),"A value for maximum or minimum value in the dictionary, use when the maximum or minimum value is determined by the unit. ","Used for measures when the constraints on maximum and minimmum value are specified by the unit, not the measure.",2.0.0,2.0.0,added in V2.0.0,
tra000729,eng,loq,Limit of quantification (LOQ),Loq,Limit of quantification (LOQ) for this method if one exists.,1.1.0,2.0.0,added in V2.0.0,
tra000730,eng,snfl,Sewer network file link depreciated 2,Link to a file that has any detailed information about the sewer network associated with the site (any format).,Depreciate in version 2. This attribute has been changed to referenceLink. Use po_referenceLink to specify polygon link to sewer network file.,1.0.0,2.0.0,depreciated,
tra000731,eng,storTempDef,Sewer network file blob,A file blob that has any detailed information about the sewer network associated with the site (any format).,"Deprecated in version 2, please do not use. Refer to WKT and EPSG instead.",1.0.0,2.0.0,depreciated,
tra000732,eng,tyOtDep2,Type other depreciate2,Description of the site when the site is not listed. See siteType.,NA,1.0.0,2.0.0,depreciated,
tra000733,eng,phos,Total phosphorous,Total phosphorous,NA,1.1.0,2.0.0,"description wording, structure",
tra000734,eng,seqLaySet,Sequencing Layout set,The set for the layout of genetic material used in sequencing,NA,2.0.0,2.0.0,added in V2.0.0,
tra000735,eng,seqSelSet,Sequencing selection method set,The set for the selection method used in sequencing,NA,2.0.0,2.0.0,added in V2.0.0,
tra000736,eng,seqStratSet,Sequencing Strategy set,The set for the sequencing strategy used for an analysis,NA,2.0.0,2.0.0,added in V2.0.0,
tra000737,eng,serialDilution,Serial dilution,The serial dilution method for assessing inhibition.,NA,2.0.0,2.0.0,added in V2.0.0,
tra000738,eng,phostot,Total Phosphates,Total phosphates,NA,1.1.0,2.0.0,"description wording, structure",
tra000739,eng,status,Status,Whether the part is still active and can be used in the most current ODM version. Values are 'active' or 'inactive'.,The status of the part or list. 'active' means the part is used in the dictionary version. 'inactive' means the part has been retired and not longer used in the version.,1.0.0,2.0.0,added in V2.0.0,
tra000740,eng,sampleRelationshipsRequired,Sample relationships table required headers,Specifies the columns required in a Sample Relationships table.,NA,2.0.0,2.0.0,added in V2.0.0,
tra000741,eng,sampleRelationshipsOrder,Sample relationships table column order,Specifies the order of the columns in a Sample Relationships table.,NA,2.0.0,2.0.0,added in V2.0.0,
tra000742,eng,measureSets,Measure set report table,The table that identifies sets of measures.,"Examples of measure sets include a set of replicates, dilutions (used to generate a Ct curve) or varients that are identified in a single sample.",2.0.0,2.0.0,added in V2.0.0,
tra000743,eng,firstReleased,First released version,The version in which a part was first released,NA,2.0.0,2.0.0,added in V2.0.0,
tra000744,eng,lastUpdated,Last updated version,The version in which the part was last updated.,Any change to the part of list will result in a change in the lastUpdated field to the dictionary version where the update occurred. ,2.0.0,2.0.0,added in V2.0.0,
tra000745,eng,aDateStart,Analysis date start,Date the measurement or analysis was started.,NA,1.0.0,2.0.0,NA,
tra000746,eng,sevSet,Severity set,A set for severity indicators.,NA,2.0.0,2.0.0,added in V2.0.0,
tra000747,eng,siteMeasureID,Site measure ID,Unique identifier for wide table only. Use when all measures are performed on a single sample.,Depreciate in version 2. siteMeasures,1.0.0,2.0.0,depreciated,
tra000748,eng,shedSet,Sampleshed set,The set for all valid values of sampleshed.,NA,2.0.0,2.0.0,added in V2.0.0,
tra000749,eng,ship,Ship,A cruise ship or other ship.,NA,2.0.0,2.0.0,added in V2.0.0,
tra000750,eng,protocolsRequired,Protocols table required headers,Specifies the columns required in the Protocols table.,NA,2.0.0,2.0.0,added in V2.0.0,
tra000751,eng,si,Site,A measure made on a compartment or property at a site.,"An example is the wastewater flow rate, taken at a wasteawater treatment plant.",2.0.0,2.0.0,added in V2.0.0,
tra000752,eng,tssConc,Concentration of total suspended solids,Total suspended solids concentration of the wastewater.,NA,1.0.0,2.0.0,"description wording, structure",
tra000753,eng,sinLay,Single Layout,Specifies the single layout for a sequencing method,NA,2.0.0,2.0.0,added in V2.0.0,
tra000754,eng,siSaSpecimenSet,Site or sample specimen set,A specimen set that inculdes site or sample specimen.,NA,2.0.0,2.0.0,added in V2.0.0,
tra000755,eng,siSpecimenSet,Site specimen set,A specimen set that inculdes only a site specimen.,NA,2.0.0,2.0.0,added in V2.0.0,
tra000756,eng,uSiteMeasureID,U site measure ID,Unique identifier for each measurement for a site.,NA,2.0.0,2.0.0,added in V2.0.0,
tra000757,eng,siteFeat,Site features group,A group of environmental measures/methods and those pertaining to the features of a site.,NA,2.0.0,2.0.0,added in V2.0.0,
tra000758,eng,aDate,Analysis date,Date the measurement was performed in the lab.,NA,1.0.0,2.1.0,Github Issue #211,
tra000759,eng,asID,Assay ID,Links with the AssayMethod used to perform the analysis. Use instrument.ID for measures that are not viral measures.,"Deprecated as of version 2, please avoid use. Refer to methodID instead.",1.0.0,2.0.0,"depreciated, now covered by partID = methodID",
tra000760,eng,protocolsOrder,Protocols table column order,Specifies the order of the columns in the Protocols table.,NA,2.0.0,2.0.0,added in V2.0.0,
tra000761,eng,qualityReports,Quality reports table,The table for recording the various quality metrics and indicators for samples and measures.,NA,2.0.0,2.0.0,added in V2.0.0,
tra000762,eng,countriesRequired,Counries table required headers,Required headers in the countries table.,NA,2.1.0,2.1.0,added in V2.1.0,
tra000763,eng,aDateEnd,Analysis date end,Date the measurement or analysis was completed.,NA,1.0.0,2.0.0,Depreciated. See issue #211. https://github.com/Big-Life-Lab/PHES-ODM/issues/211,
tra000764,eng,siteTypeSet,Site set,set for the type of sampling site.,NA,2.0.0,2.0.0,added in V2.0.0,
tra000765,eng,fraction,Fraction analyzed,Fraction of the sample that is analyzed.,NA,1.0.0,2.0.0,"description wording, structure",
tra000766,eng,snowy,Snowy,"Qualitative category for the weather measure, specifying a snowy day.",NA,2.0.0,2.0.0,"added in V2.0.0, github issue #124 and #204",
tra000767,eng,turb,Turbidity,"A measure for the turbidity of water, or a liquid sample, quanitfying the relative clarity or opcaity of a liquid. Highly indicative of water quality.",NA,1.0.0,2.0.0,github issue #122,
tra000768,eng,solidSeparationSet,Solid separation set,set for the separation of solids.,NA,2.0.0,2.0.0,added in V2.0.0,
tra000769,eng,sourceProtocol,Source Protocol ID,"A protocol that served as a basis for another protocol. This may be due to version changes, or a referencing a protocol that was later adapted.",Populate with protocolID.,2.0.0,2.0.0,added in V2.0.0,
tra000770,eng,sourceStep,Protocol step source ID,Specifies the protocol step which serves as a basis for a given protocol step.,Populate with a protocol step ID (stepID).,2.0.0,2.0.0,added in V2.0.0,
tra000771,eng,sovereignty,Sovereign status of a country,"Sovereign status of a country, indicating which state has the highest jurisdiction over a given territory.","Preprogrammed into dictionary tables, not editable by users.",2.1.0,2.1.0,added in V2.1.0,
tra000772,eng,specHumidUnitSet,Specific humidity unit set,Unit set for specific humidity.,NA,2.0.0,2.0.0,added in V2.0.0,
tra000773,eng,specifies,Specifies,Specifies that the object step or protocol occurs specifies details for the subject step or protocol in the overall protocol container.,Use only for protocolRelationships table relationshipID.,2.0.0,2.0.0,added in V2.0.0,
tra000774,eng,sentDate,Date sample was sent,Date that the sample was sent from the collection site to the lab.,NA,2.0.0,2.0.0,"added in V2.0.0, Update in line with Github Issue #211",
tra000775,eng,specimens,Specimens,"Measures or observations are taken from three types of substances: populations (humans or geographic areas), samples, sites.",See partID = specimentID,2.0.0,2.0.0,added in V2.0.0,
tra000776,eng,countriesOrder,Countries table column order,Specifies the order of the columns in the countries table.,NA,2.1.0,2.1.0,added in V2.1.0,
tra000777,eng,spike,Spike matrix and recovery,The spike matrix and recovery method for assessing inhibition.,NA,2.0.0,2.0.0,added in V2.0.0,
tra000778,eng,spikeMatSet,Spike material set,set for spikeMat (aterial into which the recovery efficiency control target is spiked).,NA,2.0.0,2.0.0,added in V2.0.0,
tra000779,eng,spikeTargetSet,Recovery efficiency spike target set,The set capturing containing all of the valid categories for the recovery efficiency control (or spike) target.,NA,2.0.0,2.0.0,added in V2.0.0,
tra000780,eng,wind,Wind Speed,A measure for wind speed; part of a larger suite of weather measures that may be useful when collecting samples from outdoor sources.,NA,2.0.0,2.0.0,added in V2.0.0,
tra000781,eng,sss,Social services shelter,Other type of social services shelter,NA,2.0.0,2.0.0,added in V2.0.0,
tra000782,eng,stabPnd,Stabilization pond,Specifies a site type which is a pond designed and built for wastewater treatment to reduce the organic content and remove pathogens from wastewater.,NA,1.0.0,2.0.0,"description wording, structure",
tra000783,eng,stateProvLevel,"Departments, states, or provinces","Departments, states, or provinces",NA,2.0.0,2.1.0,added in V2.0.0,
tra000784,eng,stepID,Protocol Step ID,The unique identifier for a specific protocol step.,"Protocol Steps are the component parts of a larger protocols, the latter being linked to specific measure reports.",2.0.0,2.0.0,added in V2.0.0,
tra000785,eng,sampleRelationships,Sample relationships table,Table for recording the relationships between samples.,"Samples can be pooled or split. The sample relationships table holds information on parent-child relationships between samples, and allow for tracking sample lineage for single and pooled samples.",2.0.0,2.0.0,added in V2.0.0,
tra000786,eng,statusSet,Status set,A set for partID = Status to indicate whether a part is in current use or not.,NA,2.0.0,2.0.0,added in V2.0.0,
tra000787,eng,stdConcentrationUnitSet,Standard concentration unit set,Unit set for concentration measurements.,NA,2.0.0,2.0.0,added in V2.0.0,
tra000788,eng,recDate,Date sample recieved,The date the sample was received at the laboratory for analysis.,NA,2.0.0,2.0.0,"added in V2.0.0, Update in line with Github Issue #211",
tra000789,eng,translationID,Synthetic ID for the translations table,"A unique, autoincremental ID generated to produce a unique identifier and primary key for each row of the translations table.",NA,2.2.0,2.2.0,added in V2.2.0,
tra000790,eng,protocolIDSub,Protocol ID subject,"The subject of the relationship between one protocol and another protocol or step, within a given protocol ID container.",Populate this field using Protocol ID (partID = protocolID). Together with `protocolIDObj` or `stepIDObj` and `relationshipID` the row of `protocolRelationships` should say: [protocolIDSubject or stepIDSubject]  [relationshipID] [protocolIDObject or stepIDObject]. Ex: stepIDSubject  precedes protocolIDObject.,2.0.0,2.0.0,added in V2.0.0,
tra000791,eng,stepProvenanceID,Method step parent ID,"A method step that served as a basis for another method step. This may be due to version changes, or a referencing a method set that was later adapted.",NA,2.0.0,2.0.0,added in V2.0.0,
tra000792,eng,measOth,Other Measure,"Other measure, not otherwise specified in measures.",Add description to categoryOther.,1.0.0,2.0.0,"Depreciated in version 2 with all ""other"" fields",
tra000793,eng,meOthDe,Other Measure Description,Description of other measure (measOtherDesc).,NA,1.0.0,2.0.0,"Depreciated in version 2 with all ""other"" fields",
tra000794,eng,index,Index,Index number in case the measurement was taken multiple times.,NA,1.1.0,2.0.0,NA,
tra000795,eng,summary,Summary worksheet,Summary sheet of the dictionary.xlxs file.,The summary sheet contains versioning and changelog.,2.0.0,2.0.0,added in V2.0.0,
tra000796,eng,sunny,Sunny,"Qualitative category for the weather measure, specifying a clear and sunny day.",NA,2.0.0,2.0.0,"added in V2.0.0, github issue #124 and #204",
tra000797,eng,surf,Surface compartment,A measure or observation made from a substance on a surface.,NA,2.0.0,2.0.0,added in V2.0.0,
tra000798,eng,surface,Other surface,Surface other than floor or desk.,See also categories for floor and desk. ,2.0.0,2.0.0,added in V2.0.0,
tra000799,eng,surfaceCompartmentSet,Surface compartment set,A compartment set for measures and methods in the surface compartment.,NA,2.0.0,2.0.0,added in V2.0.0,
tra000800,eng,surfaceWaterCompartmentSet,Surface and water compartment set,A compartment set for measures and methods in the surface or water compartments.,NA,2.0.0,2.0.0,added in V2.0.0,
tra000801,eng,surfSw,Surface swab,Surface swab.,NA,2.0.0,2.0.0,added in V2.0.0,
tra000802,eng,wwtpCap,Wastewater treatment plant designed capacity,"A measure for the designed capacity of a wastewater treatment plant, in terms of how much water it was designed to be able to hold and process.",NA,1.0.0,2.0.0,"description wording, structure",
tra000803,eng,covN1,SARS-CoV-2-N1,"SARS-CoV-2 nucleocapsid gene, allele 1.",NA,1.0.0,2.0.0,"description wording, structure",
tra000804,eng,covN2,SARS-CoV-2-N2,"SARS-CoV-2 nucleocapsid gene, allele 2.",NA,1.0.0,2.0.0,"description wording, structure",
tra000805,eng,synthetic,Synthetic sample,A synthetic or artificially generated sample.,"Synthetic samples are artificially created by mixing known quantities of target substances or organisms with clean water, often in a laboratory setting. These samples are used as controls, benchmarks, or calibration standards during the analysis process to ensure accurate and reliable results. For instance, a synthetic sample containing a known concentration of a specific pollutant might be used to calibrate analytical equipment or to test the efficiency of a new detection method.",2.0.0,2.0.0,"added in V2.0.0, GitHub issue #94",
tra000806,eng,tables,Tables,"Tables are where measures, methods and attributes are recorded. Tables represent the main entities of the environmental surveillance. There","An example of a  table is `site` a collection of attributes such as site name and address to describe where environment samples are taken. PHES-ODM has report tables, but users can create their own tables as well.",2.0.0,2.0.0,added in V2.0.0,
tra000807,eng,tableSet,Table column set,The set for valid inputs in table columns.,These categories are used in the parts list for columns named after tables to indicate the position and function of a given part in the entity relationship diagram of the data model.,2.0.0,2.0.0,added in V2.0.0,
tra000808,eng,temperatureUnitSet,Temperature unit set,Unit set for temperature measurements.,NA,2.0.0,2.0.0,added in V2.0.0,
tra000809,eng,terminal,Airport terminal,Airport terminal sample shed category type,NA,2.0.0,2.0.0,added in V2.0.0,
tra000810,eng,covN3,SARS-CoV-2-N3,"SARS-CoV-2 nucleocapsid gene, allele 3.",NA,1.0.0,2.0.0,"description wording, structure",
tra000811,eng,testing,Testing,A measure or sample taken to test a new method. These measures are typically used for internal lab uses and not reported to external partners.,NA,2.0.0,2.0.0,added in V2.0.0,
tra000812,eng,thermMag,thermo magmax microbiome ultra nucleic acid isolation kit,Nucleic acid extraction performed using the thermo magmax microbiome ultra nucleic acid isolation kit.,NA,2.0.0,2.0.0,added in V2.0.0,
tra000813,eng,timeUnitSet,Time unit set,The unit set for measures of time.,NA,2.0.0,2.0.0,added in V2.0.0,
tra000814,eng,tld,Country code top-level domain,"The internet top-level domain generally used or reserved for a country, sovereign state, or dependent territory identified with a country code.","Preprogrammed into dictionary tables, not editable by users.",2.1.0,2.1.0,added in V2.1.0,
tra000815,eng,zonesRequired,Zones table required headers,Required headers in the zones table.,NA,2.1.0,2.1.0,added in V2.1.0,
tra000816,eng,wideName,Wide Name,Unique identifier for wide table only. Use when all measures are performed on a single sample at the same time and same laboratory. Suggestion: siteID_sampleID_LabID_reportDate_ID.,NA,2.0.0,2.0.0,added in V2.0.0,
tra000817,eng,zonesOrder,Zones table column order,Specifies the order of the columns in the zones table.,NA,2.1.0,2.1.0,added in V2.1.0,
tra000818,eng,trizol,"trizol, zymo mag beads w/ zymo clean and concentrator","Nucleic acid extraction performed using the trizol, zymo mag beads w/ zymo clean and concentrator method.",NA,2.0.0,2.0.0,added in V2.0.0,
tra000819,eng,TRUE,TRUE,Boolean data type = TRUE,"Use only ""TRUE"" (case sensitive)",1.0.0,2.0.0,added in V2.0.0,
tra000820,eng,turbidityUnitSet,Turbidity unit set,Unit set for turbidity measurements.,NA,2.0.0,2.0.0,added in V2.0.0,
tra000821,eng,wideMeasure,Measure identification (wide table),Unique identifier for a measure in a wide table only. ,NA,2.0.0,2.0.0,added in V2.0.0,
tra000822,eng,allOrgs,Access to all org,"If this is 'no', this data will not be available to any partner organization. If missing, data will be available to the all organizations.",NA,1.0.0,2.0.0,depreciated,
tra000823,eng,covRdrp,SARS-CoV-2-RdRp,SARS-CoV-2 RdRp gene.,NA,1.0.0,2.0.0,"description wording, structure",
tra000824,eng,undisc,Undisclosed,"A value has been recorded, however it was not included in the dataset.",Missing value indicator for data that has not been shared or disclosed with outside parties.,1.0.0,2.0.0,added in V2.0.0,
tra000825,eng,unique,Unique sample,"A unique sample, not duplicated.",NA,2.0.0,2.0.0,"added in V2.0.0, GitHub issue #94",
tra000826,eng,wideNamesRequired,Wide name table required,Column for indicating which fields in the wide names table are mandatory.,NA,2.2.0,2.2.0,added in V2.2.0,
tra000827,eng,unitlessUnitSet,Unitless unit set,Unit set for measurements that does not have units.,NA,2.0.0,2.0.0,added in V2.0.0,
tra000828,eng,units,Units,The unit of the measurement.,"Every measurement must have a unit. Meaning, `units` are a mandatory field whenever a measurement is recorded.",2.0.0,2.0.0,added in V2.0.0,
tra000829,eng,wideNamesOrder,Wide name table order,Column for indicating the order of the fields in the wide names table.,NA,2.2.0,2.2.0,added in V2.2.0,
tra000830,eng,unitSets,Unit sets,Sets of units. Contains units that are associated with part types such as measures.,"Sets are lists of input values. Each input value within a set is a part (has a partID) that can be reused between sets. For example, a set A could contain the values of 'yes' and 'no'; and set B could contain the values of 'yes', 'no', and 'maybe.' partTypes with sets include aggregations, compartments, missingness, quality flags, specimens, and units. Measures with categories and dataTypes have their own specific sets (catSetID) because their input values are unique and are not reused.",2.0.0,2.0.0,added in V2.0.0,
tra000831,eng,upperCI95,Upper limit of a 95% confidence interval,Specifies the the upper limit of a 95% confidence interval.,"A catch-all category for upstream wastewater sampling sites, including major sewer pipelines and pumping stations.",1.0.0,2.0.0,"description wording, structure",
tra000832,eng,uSCm,Micro-Siemens per centimetre,Micro-siemens per centimetre.,NA,1.0.0,2.0.0,maintained,
tra000833,eng,utc,Coordinated universal time (UTC) zone,UTC – Time zone.,"Preprogrammed into dictionary tables, not editable by users.",2.1.0,2.1.0,added in V2.1.0,
tra000834,eng,utcDST,Coordinated universal time (UTC) zone in daylight savings,Time zone during Daylight Saving Time.,"Preprogrammed into dictionary tables, not editable by users.",2.1.0,2.1.0,added in V2.1.0,
tra000835,eng,validationStudy,Validation study,A meaure or sample taken for a validation study.,NA,2.0.0,2.0.0,added in V2.0.0,
tra000836,eng,sampleIDObject,Sample ID object,Populated by `sampleID` - this specifies the object of a sample relationship.,Use `sampleID` for this field. Together with `sampleIDSub` and `relationshipID` the row of the `sampleRelationships` should say: [sampleIDSubject] is a[relationshipID] of [sampleIDObject],2.0.0,2.0.0,added in V2.0.0,
tra000837,eng,vax3plus,Population with 3+ or more doses of vaccine,"The population with 3 or more doses of vaccine, with the vaccine specified in the measure field.",A unit used for for specifying a population-wide vaccination level measure.,2.0.0,2.0.0,added in V2.0.0,
tra000838,eng,version1Category,ODM V1 category,ODM V1 category,NA,2.0.0,2.0.0,added in V2.0.0,
tra000839,eng,version1Location,ODM V1 location,ODM V1 location,NA,2.0.0,2.0.0,added in V2.0.0,
tra000840,eng,version1Table,ODM V1 table,ODM V1 table,NA,2.0.0,2.0.0,added in V2.0.0,
tra000841,eng,version1to2Changes,ODM version 1 to 2 changes,Changes for part between ODM v1 and V2,NA,2.0.0,2.0.0,added in V2.0.0,
